Trial 14 finished with value: 152.3682412 and parameters: {'batch_size': 512, 'n_steps': 64, 'gamma': 0.95, 'learning_rate': 1.1223458552535975e-05, 'ent_coef': 3.851877602201753e-06, 'clip_range': 0.1, 'n_epochs': 20, 'gae_lambda': 0.95, 'max_grad_norm': 0.8, 'vf_coef': 0.6652823661151493, 'net_arch': 'large', 'log_std_init': -3.146078870240257, 'sde_sample_freq': 128, 'ortho_init': True, 'activation_fn': 'tanh'}. Best is trial 14 with value: 152.3682412.

Trial 15 finished with value: 107.4282709 and parameters: {'batch_size': 64, 'n_steps': 128, 'gamma': 0.995, 'learning_rate': 5.594479136219305e-05, 'ent_coef': 0.0658039421242606, 'clip_range': 0.4, 'n_epochs': 1, 'gae_lambda': 1.0, 'max_grad_norm': 5, 'vf_coef': 0.02250232118465678, 'net_arch': 'medium', 'log_std_init': -0.3259393021793189, 'sde_sample_freq': 128, 'ortho_init': True, 'activation_fn': 'tanh'}. Best is trial 15 with value: 107.4282709.

Trial 37 finished with value: 193.2565788 and parameters: {'batch_size': 8, 'n_steps': 512, 'gamma': 0.99, 'learning_rate': 5.312692549479832e-05, 'ent_coef': 0.0008951609282303143, 'clip_range': 0.1, 'n_epochs': 1, 'gae_lambda': 0.99, 'max_grad_norm': 0.9, 'vf_coef': 0.78450131028898, 'net_arch': 'large', 'log_std_init': -3.713850376675632, 'sde_sample_freq': 128, 'ortho_init': True, 'activation_fn': 'tanh'}. Best is trial 53 with value: 257.89599450000003.

Trial 53 finished with value: 257.89599450000003 and parameters: {'batch_size': 64, 'n_steps': 256, 'gamma': 0.995, 'learning_rate': 9.588306047526999e-05, 'ent_coef': 5.244878161788069e-07, 'clip_range': 0.1, 'n_epochs': 5, 'gae_lambda': 0.98, 'max_grad_norm': 0.9, 'vf_coef': 0.19073651455821386, 'net_arch': 'medium', 'log_std_init': 0.7866348519050242, 'sde_sample_freq': 128, 'ortho_init': True, 'activation_fn': 'tanh'}. Best is trial 53 with value: 257.89599450000003.

Trial 83 finished with value: 172.4369696 and parameters: {'batch_size': 64, 'n_steps': 256, 'gamma': 0.9999, 'learning_rate': 4.1225926456566045e-05, 'ent_coef': 5.86879397403554e-07, 'clip_range': 0.1, 'n_epochs': 5, 'gae_lambda': 0.98, 'max_grad_norm': 0.9, 'vf_coef': 0.19910809932519186, 'net_arch': 'medium', 'log_std_init': -1.0919085948846083, 'sde_sample_freq': 128, 'ortho_init': True, 'activation_fn': 'tanh'}. Best is trial 53 with value: 257.89599450000003.

Trial 74 finished with value: 203.22821879999998 and parameters: {'batch_size': 64, 'n_steps': 256, 'gamma': 0.995, 'learning_rate': 0.0023149743522266116, 'ent_coef': 5.573358128079249e-06, 'clip_range': 0.1, 'n_epochs': 5, 'gae_lambda': 0.98, 'max_grad_norm': 2, 'vf_coef': 0.2732648696652161, 'net_arch': 'medium', 'log_std_init': -0.5509499044997624, 'sde_sample_freq': 128, 'ortho_init': True, 'activation_fn': 'tanh'}. Best is trial 53 with value: 257.89599450000003.

Trial 70 finished with value: 201.23085369999998 and parameters: {'batch_size': 128, 'n_steps': 512, 'gamma': 0.99, 'learning_rate': 0.0008720379065829692, 'ent_coef': 0.0013989646567876244, 'clip_range': 0.4, 'n_epochs': 10, 'gae_lambda': 1.0, 'max_grad_norm': 5, 'vf_coef': 0.29601497688190925, 'net_arch': 'large', 'log_std_init': -2.176246129149636, 'sde_sample_freq': 32, 'ortho_init': True, 'activation_fn': 'tanh'}. Best is trial 53 with value: 257.89599450000003

Trial 19 finished with value: 262.5614284 and parameters: {'batch_size': 256, 'n_steps': 1024, 'gamma': 0.98, 'learning_rate': 0.0006905843913061805, 'ent_coef': 0.022694858251377927, 'clip_range': 0.1, 'n_epochs': 1, 'gae_lambda': 0.8, 'max_grad_norm': 0.7, 'vf_coef': 0.7445807875710113, 'net_arch': 'large', 'log_std_init': -0.5482045338158068, 'sde_sample_freq': 128, 'ortho_init': True, 'activation_fn': 'tanh'}. Best is trial 19 with value: 262.5614284.