TUNING 1:

Trial 30 finished with value: 363.8290392 and parameters: {'batch_size': 256, 'n_steps': 256, 'gamma': 0.9999, 'learning_rate': 0.003258537808118752, 'ent_coef': 0.0062350661245563705, 'clip_range': 0.2, 'n_epochs': 5, 'gae_lambda': 0.95, 'max_grad_norm': 0.7, 'vf_coef': 0.3661911770549592, 'net_arch': 'small', 'log_std_init': -2.790242885942397, 'sde_sample_freq': 64, 'ortho_init': True, 'activation_fn': 'leaky_relu', 'lr_schedule': 'linear'}. Best is trial 30 with value: 363.8290392.

Trial 415 finished with value: 374.69121160000003 and parameters: {'batch_size': 512, 'n_steps': 128, 'gamma': 0.95, 'learning_rate': 7.591721320973319e-05, 'ent_coef': 9.285276163104293e-07, 'clip_range': 0.1, 'n_epochs': 5, 'gae_lambda': 0.8, 'max_grad_norm': 2, 'vf_coef': 0.8814194116632252, 'net_arch': 'tiny', 'log_std_init': -2.7334498403316516, 'sde_sample_freq': 16, 'ortho_init': True, 'activation_fn': 'leaky_relu', 'lr_schedule': 'constant'}. Best is trial 329 with value: 405.10401599999994

Trial 229 finished with value: 348.4917742 and parameters: {'batch_size': 64, 'n_steps': 128, 'gamma': 0.9999, 'learning_rate': 0.00035755330974459215, 'ent_coef': 1.5032772960035262e-08, 'clip_range': 0.3, 'n_epochs': 20, 'gae_lambda': 0.8, 'max_grad_norm': 0.5, 'vf_coef': 0.9300919680309242, 'net_arch': 'medium', 'log_std_init': -3.6567843661781554, 'sde_sample_freq': 16, 'ortho_init': True, 'activation_fn': 'leaky_relu', 'lr_schedule': 'constant'}. Best is trial 30 with value: 363.8290392.

Trial 110 finished with value: 422.5982448000001 and parameters: {'batch_size': 128, 'n_steps': 64, 'gamma': 0.99, 'learning_rate': 0.0004928025740678683, 'ent_coef': 0.002165779242244648, 'clip_range': 0.4, 'n_epochs': 1, 'gae_lambda': 1.0, 'max_grad_norm': 0.7, 'vf_coef': 0.17554585840839984, 'net_arch': 'tiny', 'log_std_init': -0.7073930006152279, 'sde_sample_freq': 256, 'ortho_init': True, 'activation_fn': 'relu', 'lr_schedule': 'linear'}. Best is trial 110 with value: 422.5982448000001.

Trial 44 finished with value: 452.2629128 and parameters: {'batch_size': 32, 'n_steps': 2048, 'gamma': 0.95, 'learning_rate': 0.00021243303991845677, 'ent_coef': 0.0001223532933316859, 'clip_range': 0.1, 'n_epochs': 5, 'gae_lambda': 0.99, 'max_grad_norm': 0.7, 'vf_coef': 0.6215142166966646, 'net_arch': 'medium', 'log_std_init': -2.9863975746713614, 'sde_sample_freq': -1, 'ortho_init': True, 'activation_fn': 'elu', 'lr_schedule': 'linear'}. Best is trial 44 with value: 452.2629128.

Trial 32 finished with value: 321.2919508 and parameters: {'batch_size': 128, 'n_steps': 16, 'gamma': 0.9, 'learning_rate': 8.278309299377266e-05, 'ent_coef': 6.696237252009133e-08, 'clip_range': 0.3, 'n_epochs': 5, 'gae_lambda': 0.99, 'max_grad_norm': 0.9, 'vf_coef': 0.6851573811147811, 'net_arch': 'small', 'log_std_init': -3.3251798436401145, 'sde_sample_freq': 32, 'ortho_init': True, 'activation_fn': 'relu', 'lr_schedule': 'linear'}. Best is trial 32 with value: 321.2919508.

Trial 221 finished with value: 439.06407079999997 and parameters: {'batch_size': 128, 'n_steps': 64, 'gamma': 0.98, 'learning_rate': 3.4423134751940406e-05, 'ent_coef': 0.00010583123274435741, 'clip_range': 0.1, 'n_epochs': 1, 'gae_lambda': 0.98, 'max_grad_norm': 0.7, 'vf_coef': 0.7928979558594931, 'net_arch': 'small', 'log_std_init': -2.1500920118129923, 'sde_sample_freq': 8, 'ortho_init': True, 'activation_fn': 'tanh', 'lr_schedule': 'linear'}. Best is trial 44 with value: 452.2629128.

Trial 219 finished with value: 334.10628779999996 and parameters: {'batch_size': 128, 'n_steps': 16, 'gamma': 0.9, 'learning_rate': 0.00022723730863001876, 'ent_coef': 6.889088670929408e-08, 'clip_range': 0.3, 'n_epochs': 5, 'gae_lambda': 0.99, 'max_grad_norm': 0.9, 'vf_coef': 0.37414628198358574, 'net_arch': 'small', 'log_std_init': -3.1959415335258474, 'sde_sample_freq': 32, 'ortho_init': True, 'activation_fn': 'relu', 'lr_schedule': 'linear'}. Best is trial 44 with value: 452.2629128.

Trial 230 finished with value: 344.5068726 and parameters: {'batch_size': 128, 'n_steps': 64, 'gamma': 0.98, 'learning_rate': 9.059864941012618e-05, 'ent_coef': 5.590639581035883e-07, 'clip_range': 0.2, 'n_epochs': 1, 'gae_lambda': 0.98, 'max_grad_norm': 0.7, 'vf_coef': 0.7271437119501443, 'net_arch': 'small', 'log_std_init': -2.301657755921614, 'sde_sample_freq': 16, 'ortho_init': True, 'activation_fn': 'tanh', 'lr_schedule': 'linear'}. Best is trial 44 with value: 452.2629128.

Trial 231 finished with value: 359.75000600000004 and parameters: {'batch_size': 128, 'n_steps': 16, 'gamma': 0.9999, 'learning_rate': 2.59738275281876e-05, 'ent_coef': 0.0033222015792103957, 'clip_range': 0.3, 'n_epochs': 10, 'gae_lambda': 0.99, 'max_grad_norm': 0.6, 'vf_coef': 0.04242349379901221, 'net_arch': 'small', 'log_std_init': -2.9237448295331987, 'sde_sample_freq': 256, 'ortho_init': True, 'activation_fn': 'relu', 'lr_schedule': 'constant'}. Best is trial 44 with value: 452.2629128.

Trial 139 finished with value: 332.13602720000006 and parameters: {'batch_size': 32, 'n_steps': 1024, 'gamma': 0.99, 'learning_rate': 0.004184091218408866, 'ent_coef': 0.000635162431488648, 'clip_range': 0.3, 'n_epochs': 20, 'gae_lambda': 0.98, 'max_grad_norm': 0.7, 'vf_coef': 0.31864058284377494, 'net_arch': 'medium', 'log_std_init': -2.282712322026713, 'sde_sample_freq': 128, 'ortho_init': True, 'activation_fn': 'relu', 'lr_schedule': 'linear'}. Best is trial 44 with value: 452.2629128

Trial 295 finished with value: 370.7925522 and parameters: {'batch_size': 64, 'n_steps': 8, 'gamma': 0.95, 'learning_rate': 4.445157391425954e-05, 'ent_coef': 0.00011783887272099109, 'clip_range': 0.3, 'n_epochs': 10, 'gae_lambda': 0.99, 'max_grad_norm': 2, 'vf_coef': 0.5984064125601662, 'net_arch': 'small', 'log_std_init': -2.6024530228102196, 'sde_sample_freq': 32, 'ortho_init': True, 'activation_fn': 'relu', 'lr_schedule': 'linear'}. Best is trial 44 with value: 452.2629128.

TUNING 2:

Trial 58 finished with value: 222.73450839999995 and parameters: {'batch_size': 16, 'n_steps': 512, 'gamma': 0.995, 'learning_rate': 4.126014820114161e-05, 'ent_coef': 1.2976966319050577e-06, 'clip_range': 0.2, 'n_epochs': 5, 'gae_lambda': 0.92, 'max_grad_norm': 5, 'vf_coef': 0.11593787132779229, 'net_arch': 'medium', 'log_std_init': -2.666902486769448, 'sde_sample_freq': 16, 'ortho_init': True, 'activation_fn': 'tanh'}. Best is trial 58 with value: 222.73450839999995.

Trial 24 finished with value: 218.0506846 and parameters: {'batch_size': 64, 'n_steps': 512, 'gamma': 0.95, 'learning_rate': 8.367280159337815e-05, 'ent_coef': 2.1713692981065386e-08, 'clip_range': 0.3, 'n_epochs': 1, 'gae_lambda': 1.0, 'max_grad_norm': 0.7, 'vf_coef': 0.0010098852891424759, 'net_arch': 'medium', 'log_std_init': 0.32628040821048643, 'sde_sample_freq': -1, 'ortho_init': True, 'activation_fn': 'tanh'}. Best is trial 24 with value: 218.0506846.

Trial 6 finished with value: 173.33497129999998 and parameters: {'batch_size': 16, 'n_steps': 512, 'gamma': 0.995, 'learning_rate': 5.0747179654107434e-05, 'ent_coef': 1.1936971131372152e-06, 'clip_range': 0.1, 'n_epochs': 5, 'gae_lambda': 0.92, 'max_grad_norm': 5, 'vf_coef': 0.10721069613508172, 'net_arch': 'large', 'log_std_init': -3.919163328074771, 'sde_sample_freq': 16, 'ortho_init': True, 'activation_fn': 'tanh'}. Best is trial 6 with value: 173.33497129999998.

Trial 5 finished with value: 126.48305980000002 and parameters: {'batch_size': 256, 'n_steps': 16, 'gamma': 0.99, 'learning_rate': 3.994330997581904e-05, 'ent_coef': 1.2234872721169238e-06, 'clip_range': 0.1, 'n_epochs': 1, 'gae_lambda': 1.0, 'max_grad_norm': 0.8, 'vf_coef': 0.42356598700318016, 'net_arch': 'large', 'log_std_init': -2.1683496333681305, 'sde_sample_freq': 32, 'ortho_init': True, 'activation_fn': 'tanh'}. Best is trial 5 with value: 126.48305980000002

Trial 5 finished with value: 178.6066444 and parameters: {'batch_size': 128, 'n_steps': 32, 'gamma': 0.9999, 'learning_rate': 1.6352644570603173e-05, 'ent_coef': 0.003086479756676707, 'clip_range': 0.3, 'n_epochs': 1, 'gae_lambda': 0.99, 'max_grad_norm': 0.8, 'vf_coef': 0.2787092540108892, 'net_arch': 'medium', 'log_std_init': -0.3582613728964752, 'sde_sample_freq': -1, 'ortho_init': True, 'activation_fn': 'tanh'}. Best is trial 5 with value: 178.6066444

Trial 29 finished with value: 166.77225929999997 and parameters: {'batch_size': 128, 'n_steps': 32, 'gamma': 0.995, 'learning_rate': 4.22194915077297e-05, 'ent_coef': 3.707882170513953e-05, 'clip_range': 0.3, 'n_epochs': 1, 'gae_lambda': 0.99, 'max_grad_norm': 0.8, 'vf_coef': 0.33782935241364276, 'net_arch': 'medium', 'log_std_init': 0.3606293157577005, 'sde_sample_freq': -1, 'ortho_init': True, 'activation_fn': 'tanh'}. Best is trial 5 with value: 178.6066444.

Trial 35 finished with value: 133.1894029 and parameters: {'batch_size': 16, 'n_steps': 8, 'gamma': 0.98, 'learning_rate': 1.6355345112183692e-05, 'ent_coef': 0.002079679288908306, 'clip_range': 0.1, 'n_epochs': 1, 'gae_lambda': 0.99, 'max_grad_norm': 0.8, 'vf_coef': 0.17426749869815142, 'net_arch': 'medium', 'log_std_init': 0.5452865233267992, 'sde_sample_freq': -1, 'ortho_init': True, 'activation_fn': 'tanh'}. Best is trial 5 with value: 178.6066444.

Trial 95 finished with value: 216.28446509999998 and parameters: {'batch_size': 8, 'n_steps': 128, 'gamma': 0.9, 'learning_rate': 5.7844436257115153e-05, 'ent_coef': 0.0012849717421315008, 'clip_range': 0.1, 'n_epochs': 10, 'gae_lambda': 0.8, 'max_grad_norm': 0.7, 'vf_coef': 0.4500524984411832, 'net_arch': 'medium', 'log_std_init': -1.9441600921511677, 'sde_sample_freq': 128, 'ortho_init': True, 'activation_fn': 'tanh'}. Best is trial 82 with value: 290.1548839.

Trial 82 finished with value: 290.1548839 and parameters: {'batch_size': 256, 'n_steps': 256, 'gamma': 0.98, 'learning_rate': 4.9908359430203723e-05, 'ent_coef': 0.016977543894004236, 'clip_range': 0.4, 'n_epochs': 20, 'gae_lambda': 1.0, 'max_grad_norm': 0.8, 'vf_coef': 0.06868026097247694, 'net_arch': 'medium', 'log_std_init': 0.4446058424934571, 'sde_sample_freq': 128, 'ortho_init': True, 'activation_fn': 'tanh'}. Best is trial 82 with value: 290.1548839.

Trial 41 finished with value: 211.18915260000003 and parameters: {'batch_size': 256, 'n_steps': 8, 'gamma': 0.98, 'learning_rate': 2.2298270171634426e-05, 'ent_coef': 0.05160425691434781, 'clip_range': 0.1, 'n_epochs': 1, 'gae_lambda': 0.95, 'max_grad_norm': 0.8, 'vf_coef': 0.1656539559638957, 'net_arch': 'medium', 'log_std_init': 0.41233770587142, 'sde_sample_freq': 256, 'ortho_init': True, 'activation_fn': 'tanh'}. Best is trial 41 with value: 211.18915260000003.

Trial 78 finished with value: 205.61698299999998 and parameters: {'batch_size': 64, 'n_steps': 256, 'gamma': 0.9999, 'learning_rate': 1.9470708346678264e-05, 'ent_coef': 0.00030928927089193315, 'clip_range': 0.4, 'n_epochs': 20, 'gae_lambda': 0.95, 'max_grad_norm': 1, 'vf_coef': 0.19207496975363203, 'net_arch': 'medium', 'log_std_init': -0.431245866294686, 'sde_sample_freq': 8, 'ortho_init': True, 'activation_fn': 'tanh'}. Best is trial 41 with value: 211.18915260000003.

Trial 144 finished with value: 235.23947119999997 and parameters: {'batch_size': 128, 'n_steps': 256, 'gamma': 0.995, 'learning_rate': 0.8275846298310651, 'ent_coef': 6.490232196824165e-06, 'clip_range': 0.4, 'n_epochs': 20, 'gae_lambda': 0.8, 'max_grad_norm': 5, 'vf_coef': 0.7523420085511321, 'net_arch': 'medium', 'log_std_init': 0.3952884702871821, 'sde_sample_freq': -1, 'ortho_init': True, 'activation_fn': 'tanh'}. Best is trial 82 with value: 290.1548839.

Trial 90 finished with value: 226.69379220000002 and parameters: {'batch_size': 8, 'n_steps': 1024, 'gamma': 0.999, 'learning_rate': 0.00036902028408253274, 'ent_coef': 0.0005273995861125287, 'clip_range': 0.3, 'n_epochs': 20, 'gae_lambda': 0.8, 'max_grad_norm': 0.8, 'vf_coef': 0.7202214290556082, 'net_arch': 'medium', 'log_std_init': 0.9684786774119938, 'sde_sample_freq': -1, 'ortho_init': True, 'activation_fn': 'tanh'}. Best is trial 82 with value: 290.1548839.

Trial 265 finished with value: 233.428698 and parameters: {'batch_size': 256, 'n_steps': 256, 'gamma': 0.95, 'learning_rate': 0.061520499912789725, 'ent_coef': 1.1708587690293204e-08, 'clip_range': 0.4, 'n_epochs': 1, 'gae_lambda': 0.92, 'max_grad_norm': 0.5, 'vf_coef': 0.8806721767945774, 'net_arch': 'medium', 'log_std_init': -3.1233009693890974, 'sde_sample_freq': 256, 'ortho_init': True, 'activation_fn': 'tanh'}. Best is trial 82 with value: 290.1548839.

Trial 245 finished with value: 229.15201889999997 and parameters: {'batch_size': 8, 'n_steps': 256, 'gamma': 0.98, 'learning_rate': 0.00048244898650469403, 'ent_coef': 2.2096227325034413e-05, 'clip_range': 0.4, 'n_epochs': 20, 'gae_lambda': 1.0, 'max_grad_norm': 0.8, 'vf_coef': 0.19162839323113845, 'net_arch': 'medium', 'log_std_init': -0.8346124966945911, 'sde_sample_freq': 128, 'ortho_init': True, 'activation_fn': 'tanh'}. Best is trial 82 with value: 290.1548839.

Trial 182 finished with value: 258.9663653 and parameters: {'batch_size': 32, 'n_steps': 1024, 'gamma': 0.999, 'learning_rate': 5.0579737983244655e-05, 'ent_coef': 1.3764195393006993e-05, 'clip_range': 0.3, 'n_epochs': 20, 'gae_lambda': 0.9, 'max_grad_norm': 0.8, 'vf_coef': 0.6143442340365041, 'net_arch': 'medium', 'log_std_init': 0.938762605491832, 'sde_sample_freq': 8, 'ortho_init': True, 'activation_fn': 'tanh'}. Best is trial 82 with value: 290.1548839.

Trial 154 finished with value: 260.87321760000003 and parameters: {'batch_size': 8, 'n_steps': 1024, 'gamma': 0.999, 'learning_rate': 0.000332035892396991, 'ent_coef': 1.1347270900492148e-05, 'clip_range': 0.3, 'n_epochs': 20, 'gae_lambda': 0.8, 'max_grad_norm': 0.8, 'vf_coef': 0.8817202497124041, 'net_arch': 'medium', 'log_std_init': 0.39290493912684743, 'sde_sample_freq': -1, 'ortho_init': True, 'activation_fn': 'tanh'}. Best is trial 82 with value: 290.1548839.

Trial 211 finished with value: 248.52700609999997 and parameters: {'batch_size': 128, 'n_steps': 256, 'gamma': 0.98, 'learning_rate': 0.18176806581530272, 'ent_coef': 2.942852869797864e-07, 'clip_range': 0.4, 'n_epochs': 20, 'gae_lambda': 0.8, 'max_grad_norm': 5, 'vf_coef': 0.9096134511843019, 'net_arch': 'medium', 'log_std_init': -2.941120339113685, 'sde_sample_freq': 256, 'ortho_init': True, 'activation_fn': 'tanh'}. Best is trial 82 with value: 290.1548839.

Trial 310 finished with value: 232.6005449 and parameters: {'batch_size': 512, 'n_steps': 256, 'gamma': 0.999, 'learning_rate': 0.07010388796774801, 'ent_coef': 9.449859002079355e-05, 'clip_range': 0.4, 'n_epochs': 20, 'gae_lambda': 0.8, 'max_grad_norm': 0.9, 'vf_coef': 0.916168340799366, 'net_arch': 'medium', 'log_std_init': 0.24419672373825524, 'sde_sample_freq': -1, 'ortho_init': True, 'activation_fn': 'tanh'}. Best is trial 82 with value: 290.1548839.